{
  "schemaVersion": "2.0",
  "engineSchemaVersion": "2.0",
  "plugin": "dev-flow",
  "stateKey": "dev-flow",
  "projectSchema": {
    "head": 8,
    "minimumSupported": 0
  },
  "configTargets": {
    "1": "assets/project-refresh/config-v1.json",
    "2": "assets/project-refresh/config-v2.json",
    "3": "assets/project-refresh/config-v3.json",
    "4": "assets/project-refresh/config-v4.json",
    "5": "assets/project-refresh/config-v5.json",
    "6": "assets/project-refresh/config-v6.json",
    "7": "assets/project-refresh/config-v7.json",
    "8": "assets/project-refresh/config-v8.json"
  },
  "migrationSteps": [
    {
      "id": "legacy-selection-v0-to-v1",
      "from": 0,
      "to": 1,
      "authorization": "workflow-config-migration",
      "configTarget": 1
    },
    {
      "id": "full-openspec-v1-to-v2",
      "from": 1,
      "to": 2,
      "authorization": "workflow-config-migration",
      "configTarget": 2
    },
    {
      "id": "full-openspec-v2-to-v3",
      "from": 2,
      "to": 3,
      "authorization": "workflow-config-migration",
      "configTarget": 3
    },
    {
      "id": "full-openspec-v3-to-v4",
      "from": 3,
      "to": 4,
      "authorization": "workflow-config-migration",
      "configTarget": 4
    },
    {
      "id": "full-openspec-v4-to-v5",
      "from": 4,
      "to": 5,
      "authorization": "workflow-config-migration",
      "configTarget": 5
    },
    {
      "id": "full-openspec-v5-to-v6",
      "from": 5,
      "to": 6,
      "authorization": "workflow-config-migration",
      "configTarget": 6
    },
    {
      "id": "full-openspec-v6-to-v7",
      "from": 6,
      "to": 7,
      "authorization": "workflow-config-migration",
      "configTarget": 7
    },
    {
      "id": "full-openspec-v7-to-v8",
      "from": 7,
      "to": 8,
      "authorization": "workflow-config-migration",
      "configTarget": 8
    }
  ],
  "refreshContract": {
    "revision": 9,
    "impact": "changed",
    "evidence": {
      "changeId": "add-authorized-legacy-workflow-uninstall",
        "refreshContractRevision": 9,
        "projectSchemaHead": 8,
      "trackedInputsSha256": "fe1f16cc02885ea8814feaae7ccf3f519824ad4d37be54eb2a20eb8a8fbf9295",
      "schemaDecision": "advanced",
      "inspectedSurfaces": [
        "agents-guidance",
        "configuration",
        "control-plane-templates",
        "dependency-layout",
        "fixtures",
        "implementation-readiness",
        "legacy-workflow-uninstall",
        "lifecycle-gates",
        "migration-runtime",
        "project-local-skills",
        "project-state",
        "refresh-skill",
        "release-packaging"
      ],
        "reason": "Adds exact authorized and recoverable project-local legacy workflow uninstall behavior, preserves installed revision-4/schema-3 through revision-8/schema-7 contracts, closes independent review findings in revision 6, adds immutable-target rollback for a safe uncommitted consumer schema transition in revision 7/schema 6, preflights every receipt-bound file rollback source before any mutation in revision 8/schema 7, validates every prepared file source against the receipt-bound preimage fingerprint before any mutation in revision 9/schema 8, and preserves immutable v1/v2/v3/v4/v5/v6/v7 targets plus existing implementation-readiness behavior."
    },
    "trackedInputs": [
      ".codex-plugin/plugin.json",
      ".codex-plugin/release-sync.json",
      "README.md",
      "assets/project-refresh/config-v1.json",
      "assets/project-refresh/config-v2.json",
      "assets/project-refresh/config-v3.json",
      "assets/project-refresh/config-v4.json",
      "assets/project-refresh/config-v5.json",
        "assets/project-refresh/config-v6.json",
        "assets/project-refresh/config-v7.json",
        "assets/project-refresh/config-v8.json",
      "assets/templates/AGENTS.md.template",
      "assets/templates/ENGINEERING_POLICY.md.template",
      "assets/templates/EVIDENCE_TEMPLATE.md.template",
      "assets/templates/OPENSPEC_DESIGN.md.template",
      "assets/templates/OPENSPEC_TASKS.md.template",
      "assets/templates/REVIEW_CHECKLIST.md.template",
      "assets/templates/STATE.md.template",
      "assets/templates/TASK_LEDGER.md.template",
      "fixtures/implementation-readiness/invalid-evidence-missing-capabilities-v1.json",
      "fixtures/implementation-readiness/invalid-provider-override-anonymous-v1.json",
      "fixtures/implementation-readiness/invalid-receipt-not-ready-v1.json",
      "fixtures/implementation-readiness/invalid-requirement-v2.json",
      "fixtures/implementation-readiness/agents-guidance-markers-revision2.json",
      "fixtures/implementation-readiness/project-refresh-cases-v3.json",
      "fixtures/implementation-readiness/valid-evidence-v1.json",
      "fixtures/implementation-readiness/valid-provider-override-v1.json",
      "fixtures/implementation-readiness/valid-receipt-v1.json",
      "fixtures/implementation-readiness/valid-requirement-v1.json",
      "fixtures/project-refresh/manifest.json",
      "fixtures/project-refresh/current.json",
      "fixtures/project-refresh/current-v2.json",
      "fixtures/project-refresh/current-v3.json",
      "fixtures/project-refresh/current-v4.json",
      "fixtures/project-refresh/current-v5.json",
        "fixtures/project-refresh/current-v6.json",
        "fixtures/project-refresh/current-v7.json",
        "fixtures/project-refresh/current-v8.json",
      "fixtures/project-refresh/legacy-uninstall-cases-v4.json",
      "fixtures/project-refresh/schema-transition-cases-v5.json",
      "fixtures/project-refresh/review-hardening-cases-v6.json",
        "fixtures/project-refresh/config-preimage-cases-v7.json",
        "fixtures/project-refresh/rollback-preflight-cases-v8.json",
        "fixtures/project-refresh/file-source-fingerprint-cases-v9.json",
      "fixtures/project-refresh/legacy-conflicting-aliases.json",
      "fixtures/project-refresh/legacy-preserve-settings.json",
      "fixtures/project-refresh/legacy-root-selection.json",
      "fixtures/project-refresh/legacy-workflow-selection.json",
      "schemas/implementation-readiness-evidence-v1.schema.json",
      "schemas/implementation-readiness-provider-override-v1.schema.json",
      "schemas/implementation-readiness-receipt-v1.schema.json",
      "schemas/implementation-readiness-requirement-v1.schema.json",
      "schemas/project-refresh-contract.schema.json",
      "schemas/project-refresh-plan.schema.json",
      "schemas/project-refresh-receipt.schema.json",
      "scripts/codex_auto_update_plugins_skills.py",
      "scripts/doctor_workflow.py",
      "scripts/implementation_readiness.py",
      "scripts/inspect_legacy_workflow_config.py",
      "scripts/legacy_workflow_config.py",
      "scripts/plugin_project_migration.py",
      "scripts/plugin_project_migration_check.py",
      "scripts/release_promotion_gate.py",
      "scripts/scaffold_workflow.py",
      "scripts/sync_release_assets.py",
      "scripts/pre_edit_policy.py",
      "scripts/workflow_agent_task_contract.py",
      "scripts/workflow_archive_policy.py",
      "scripts/workflow_compact_recovery.py",
      "scripts/workflow_continuation.py",
      "scripts/workflow_contract_control_plane.py",
      "scripts/workflow_dependency_catalog.py",
      "scripts/workflow_dependency_provenance.py",
      "scripts/workflow_hooks.py",
      "scripts/workflow_legacy_uninstall.py",
      "scripts/workflow_implementation_readiness.py",
      "scripts/workflow_methodology.py",
      "scripts/workflow_mode_routing.py",
      "scripts/workflow_planning_paths.py",
      "scripts/workflow_project_activation.py",
      "scripts/workflow_project_skill_install.py",
      "scripts/workflow_project_skill_paths.py",
      "scripts/workflow_project_refresh.py",
      "scripts/workflow_release_sync.py",
      "scripts/workflow_release_verification.py",
      "scripts/workflow_scaffold.py",
      "scripts/workflow_state.py",
      "scripts/workflow_validate.py",
      "scripts/workflow_verification.py",
      "scripts/workflow_doctor.py",
      "scripts/verify_release_runtime.py",
      "skills/ai-native-tech-plan/SKILL.md",
      "skills/capability-research/SKILL.md",
      "skills/change-plan/SKILL.md",
      "skills/checkpoint-compact/SKILL.md",
      "skills/claude-code-delegate/SKILL.md",
      "skills/codex-updater/SKILL.md",
      "skills/context-health-check/SKILL.md",
      "skills/context-tool-audit/SKILL.md",
      "skills/dev-flow-refresh/SKILL.md",
      "skills/dev-flow-refresh/references/project-refresh.md",
      "skills/execute-task/SKILL.md",
      "skills/feature-intake/SKILL.md",
      "skills/plugin-project-migration/SKILL.md",
      "skills/project-orchestrator/SKILL.md",
      "skills/project-setup/SKILL.md",
      "skills/verify-and-archive/SKILL.md",
      "skills/workflow-doctor/SKILL.md"
    ]
  },
  "projectLocalSkills": [
    "ai-native-tech-plan",
    "capability-research",
    "claude-code-delegate",
    "project-orchestrator",
    "project-setup",
    "feature-intake",
    "change-plan",
    "execute-task",
    "verify-and-archive",
    "workflow-doctor",
    "checkpoint-compact",
    "context-health-check",
    "context-tool-audit",
    "codex-updater",
    "dev-flow-refresh",
    "plugin-project-migration"
  ],
  "managedFiles": [
    "ENGINEERING_POLICY.md",
    "EVIDENCE_TEMPLATE.md",
    "REVIEW_CHECKLIST.md",
    "TASK_LEDGER.md"
  ],
  "agentsGuidance": {
    "activePath": "AGENTS.md",
    "candidatePath": "AGENTS.md.generated",
    "template": "assets/templates/AGENTS.md.template"
  }
}
